key,name,description,author,pubyear,url
2.1,Forest Conservation and Slippage: Evidence from Mexico’s National Payments for Ecosystem Services Program,,Alix-Garcia et al. 2012,2012,http://le.uwpress.org/content/88/4/613.short
2.2,Do Payments for Environmental Services Affect Forest Cover? A Farm-Level Evaluation from Costa Rica,,Arriagada et al. 2012,2012,http://le.uwpress.org/content/88/2/382.short
2.3,Do Payments Pay Off? Evidence from Participation in Costa Rica's PES Program,,Arriagada et al. 2015,2015,http://journals.plos.org/plosone/article?id=10.1371/journal.pone.0131544
2.4,"Can forest-protection carbon projects improve rural livelihoods? Analysis of the Noel Kempff Mercado climate action project, Bolivia",,Asquith et al. 2002,2002,https://link.springer.com/article/10.1023/A:1024712424319
2.5,"Selling two environmental services: In-kind payments for bird habitat and watershed protection in Los Negros, Bolivia",,Asquith et al. 2008,2008,http://www.sciencedirect.com/science/article/pii/S0921800907006076
2.6,Promoting Forest Stewardship in the Bolsa Floresta Programme: Local Livelihood Strategies and Preliminary Impacts,,Borner et al. 2013,2013,http://fas-amazonas.org/versao/2012/wordpress/wp-content/uploads/2014/02/BF_report_ENG_web.pdf
2.7,Achieving Conservation and Equity amidst Extreme Poverty and Climate Risk: The Makira REDD+ Project in Madagascar,,Brimont et al. 2015,2015,http://www.mdpi.com/1999-4907/6/3/748/htm
2.8,Payments for biodiversity conservation in the context of weak institutions: Comparison of three programs from Cambodia,,Clements et al. 2010,2010,http://www.sciencedirect.com/science/article/pii/S0921800909004595
2.9,Equity implications of marketing ecosystem services in protected areas and rural communities: Case studies from Meso-America,,Corbera et al. 2007a,2007,http://www.sciencedirect.com/science/article/pii/S0959378007000040
2.10,The Equity and Legitimacy of Markets for Ecosystem Services,,Corbera et al. 2007b,2007,http://onlinelibrary.wiley.com/doi/10.1111/j.1467-7660.2007.00425.x/full
2.11,Institutional dimensions of Payments for Ecosystem Services: An analysis of Mexico's carbon forestry programme,,Corbera et al. 2009,2009,http://www.sciencedirect.com/science/article/pii/S0921800908002632
2.12,How Effective Are Biodiversity Conservation Payments in Mexico?,,Costedoat et al. 2015,2015,http://journals.plos.org/plosone/article?id=10.1371/journal.pone.0119881
2.13,Bridging the gap between forest conservation and poverty alleviation: the Ecuadorian Socio Bosque program,,DeKoning et al. 2011,2011,http://www.sciencedirect.com/science/article/pii/S1462901111000657
2.14,How Can Market Mechanisms for Forest Environmental Services Help the Poor? Preliminary Lessons from Latin America,,Grieg-Gran et al. 2005,2005,http://www.sciencedirect.com/science/article/pii/S0305750X05000999
2.15,"Payments for ecosystem services in an African protected area: exploring issues of legitimacy, fairness, equity and effectiveness",,Gross-Camp et al. 2012,2012,https://www.cambridge.org/core/journals/oryx/article/payments-for-ecosystem-services-in-an-african-protected-area-exploring-issues-of-legitimacy-fairness-equity-and-effectiveness/9926DFD2FC299A15532E20F0D238C0F9
2.16,China's conversion of cropland to forest program: a systematic review of the environmental and socioeconomic effects,,Gutierrez Rodriguez et al. 2016,2016,https://environmentalevidencejournal.biomedcentral.com/articles/10.1186/s13750-016-0071-x
2.17,"Payment for ecosystem services, sustained behavioural change, and adaptive management: peasant perspectives in the Colombian Andes",,Hayes 2012,2012,https://www.cambridge.org/core/journals/environmental-conservation/article/payment-for-ecosystem-services-sustained-behavioural-change-and-adaptive-management-peasant-perspectives-in-the-colombian-andes/8265622BE4421816847888656B179C7B
2.18,Performance of an agro-forestry based Payments-for-Environmental-Services project in Mozambique: A household level analysis,,Hegde and Bull 2011,2011,http://www.sciencedirect.com/science/article/pii/S0921800911003478
2.19,A Spatially Explicit Estimate of Avoided Forest Loss,,Honey-Roses et al. 2011,2011,http://onlinelibrary.wiley.com/doi/10.1111/j.1523-1739.2011.01729.x/full
2.20,Opportunities for biodiversity gains under the world's largest reforestation programme,,Hua et al. 2016,2016,https://www.nature.com/articles/ncomms12717
2.21,Cash for carbon: a randomized controlled trial of payments for ecosystem services to reduce deforestation,,Jayachandran et al. 2017,2017,http://science.sciencemag.org/content/357/6348/267
2.22,Reducing Poverty Through Carbon Forestry? Impacts of the N'hambita Community Carbon Project in Mozambique,,Jindal et al. 2012,2012,http://www.sciencedirect.com/science/article/pii/S0305750X12001131
2.23,Combining Auctions and Performance-Based Payments in a Forest Enrichment Field Trial in Western Kenya,,Khalumba et al. 2014,2014,http://onlinelibrary.wiley.com/doi/10.1111/cobi.12278/full
2.24,Payments for environmental services in watersheds: Insights from a comparative study of three cases in Central America,,Kosoy et al. 2007,2007,http://www.sciencedirect.com/science/article/pii/S0921800906001522
2.25,"Evaluating Safeguards in a Conservation Incentive Program: Participation, Consent, and Benefit Sharing in Indigenous Communities of the Ecuadorian Amazon",,Krause et al. 2013,2013,https://lup.lub.lu.se/search/publication/4146865
2.26,"Fairly efficient, efficiently fair: Lessons from designing and testing payment schemes for ecosystem services in Asia",,Leimona et al. 2015,2015,http://www.sciencedirect.com/science/article/pii/S2212041614001697
2.27,Impacts of payments for environmental services on local development in northern Costa Rica: A fuzzy multi-criteria analysis,,Locatelli et al. 2008,2008,http://www.sciencedirect.com/science/article/pii/S1389934107000883
2.28,Towards operational payments for water ecosystem services in Tanzania: a case study from the Uluguru Mountains,,Lopa et al. 2011,2011,https://www.cambridge.org/core/journals/oryx/article/towards-operational-payments-for-water-ecosystem-services-in-tanzania-a-case-study-from-the-uluguru-mountains/AB294F53F565EBC82967D297261446B8
2.29,Consequences of actor level livelihood heterogeneity for additionality in a tropical forest payment for environmental services programme with an undifferentiated reward structure,,Newton et al. 2012,2012,http://www.sciencedirect.com/science/article/pii/S0959378011001592
2.30,Payments for environmental services in Costa Rica,,Pagiola 2008,2008,http://www.sciencedirect.com/science/article/pii/S0921800907004235
2.31,"Efficiency of Payments for Environmental Services: Equity and additionality in a case study from a Biosphere Reserve in Chiapas, Mexico",,Rico Garcia Amado et al. 2011,2011,http://www.sciencedirect.com/science/article/pii/S0921800911002916
2.32,Ecopayments and Deforestation in Costa Rica: A Nationwide Analysis of PSA's Initial Years,,Robalino and Pfaff 2013,2013,http://le.uwpress.org/content/89/3/432.short
2.33,Effects of Payment for Environmental Services (PES) on Deforestation and Poverty in Low and Middle Income Countries,,Samii et al. 2014,2014,https://search.proquest.com/docview/1773949693?pq-origsite=gscholar
2.34,Evaluating the environmental impact of payments for ecosystem services in Coatepec (Mexico) using remote sensing and on-site interviews,,Scullion et al. 2011,2011,https://www.cambridge.org/core/journals/environmental-conservation/article/evaluating-the-environmental-impact-of-payments-for-ecosystem-services-in-coatepec-mexico-using-remote-sensing-and-on-site-interviews/C334283DCAAF30C5728C609817569E01
2.35,"On the efficiency of environmental service payments: A forest conservation assessment in the Osa Peninsula, Costa Rica",,Sierra and Russman 2006,2006,http://www.sciencedirect.com/science/article/pii/S0921800905004982
2.36,The Prospects for Payment for Ecosystem Services (PES) in Vietnam: A Look at Three Payment Schemes,,To et al. 2012,2012,https://link.springer.com/article/10.1007/s10745-012-9480-9
2.37,Effects of payments for ecosystem services on wildlife habitat recovery,,Tuanmu et al. 2016,,http://onlinelibrary.wiley.com/doi/10.1111/cobi.12669/full
2.38,Decentralized payments for environmental services: The cases of Pimampiro and PROFAFOR in Ecuador,,Wunder and Alban 2008,,http://www.sciencedirect.com/science/article/pii/S0921800907005320